title,company,location,link
Operations Engineer (m/f/d),AnyDesk Software GmbH,"Stuttgart, Germany",https://stackoverflow.com/jobs/361886
Senior Site Reliability Engineer,Oura Health Oy,"Helsinki, Finland",https://stackoverflow.com/jobs/399221
Distributed Systems Engineer,Oura Health Oy,"Helsinki, Finland",https://stackoverflow.com/jobs/399223
"Backend Engineer, Ecosystem Team",Oura Health Oy,"Helsinki, Finland",https://stackoverflow.com/jobs/399218
"Backend Engineer, Cloud Platform",Oura Health Oy,"Helsinki, Finland",https://stackoverflow.com/jobs/399217
Senior Embedded Software Design Engineer,ASML,"Veldhoven, Netherlands",https://stackoverflow.com/jobs/361993
Web Engineer,Signal AI,"London, UK",https://stackoverflow.com/jobs/273615
Software Engineer - Build the next generation of AI platform,Signal AI,"London, UK",https://stackoverflow.com/jobs/246027
Backend Engineer,Innovation Research Labs,"Amsterdam, Netherlands",https://stackoverflow.com/jobs/361971
Goldman Sachs - Vice President - Software Engineer,Goldman Sachs,"Bengaluru, India",https://stackoverflow.com/jobs/296226
Security Engineer,SmartNews,"Shibuya City, Japan",https://stackoverflow.com/jobs/399408
Datenbankadministrator (m/w/d),L-Bank,"Karlsruhe, Deutschland",https://stackoverflow.com/jobs/399406
JavaScript Frontend Software Engineer for Scientific Visualization (W/M),EPFL - Blue Brain Project,"Genève, Switzerland",https://stackoverflow.com/jobs/372725
フルリモートエンジニア,株式会社プライムスタイル,"Bunkyo City, Japan",https://stackoverflow.com/jobs/340348
Senior Web Developer,Openweb Solutions,"Kolkata, India",https://stackoverflow.com/jobs/382491
Developer â€“ Cognitive Services,Orcapod Consulting Services Private Limited,"Pune, India",https://stackoverflow.com/jobs/375482
Software Developer Network Devices,Winvest Technology Consultancy Services Private Limited,"Hyderabad, India",https://stackoverflow.com/jobs/382448
Cloud and System Engineer,Grand Parade,"Kraków, Poland",https://stackoverflow.com/jobs/399400
Database Architect,Taya Technologies Private Limited,"Hyderabad, India",https://stackoverflow.com/jobs/379824
Full Stack Developer,Gyansys Infotech Private Limited,"Bengaluru, India",https://stackoverflow.com/jobs/379802
アプリ開発エンジニア《自社製品/自社開発》,スプリームシステム株式会社,"Toshima City, Japan",https://stackoverflow.com/jobs/382381
インフラエンジニア(設計・構築),アイレット株式会社,"Minato City, Japan",https://stackoverflow.com/jobs/382376
【広島】システムエンジニア募集,株式会社　ジェイテック,"Hiroshima, Japan",https://stackoverflow.com/jobs/337226
SRE,type転職エージェント,"Shibuya City, Japan",https://stackoverflow.com/jobs/382345
テクニカルディレクター,株式会社電通テック,"Chiyoda City, Japan",https://stackoverflow.com/jobs/382342
AWSエンジニア,株式会社ダイヤモンドファンタジー,"Chuo City, Japan",https://stackoverflow.com/jobs/337198
テックリード,type転職エージェント,"Shibuya City, Japan",https://stackoverflow.com/jobs/382337
"サーバーサイドエンジニア[東京](Software Engineer, Backend)",株式会社Holmes,"Chiyoda City, Japan",https://stackoverflow.com/jobs/319847
Software Developer,Bharti HR,"Lucknow, India",https://stackoverflow.com/jobs/322853
プロダクトオーナー/ITコンサルティング,株式会社 日本データサイエンス研究所,"Bunkyo City, Japan",https://stackoverflow.com/jobs/391598
PHP Developer,PayGyft,"Kochi, India",https://stackoverflow.com/jobs/399385
Informatica Developer,Poly,"Hyderabad, India",https://stackoverflow.com/jobs/399350
Senior Technology Specialist,WELLS FARGO BANK,"Hyderabad, India",https://stackoverflow.com/jobs/396990
Python Developer,WAVELABS TECHNOLOGIES,"Hyderabad, India",https://stackoverflow.com/jobs/399347
Manager Data Science,Reliance Jio Infocomm Limited,"Hyderabad, India",https://stackoverflow.com/jobs/399344
Machine Learning Expert,ZettaMine,"Hyderabad, India",https://stackoverflow.com/jobs/354625
Python Developer,TRooTech Business Solutions,"Ahmedabad, India",https://stackoverflow.com/jobs/399343
"IT MFG Software Engineer, Application Modernization",Micron,"Hyderabad, India",https://stackoverflow.com/jobs/360908
Test Automation Engineer,LT Technology Services,"Hyderabad, India",https://stackoverflow.com/jobs/399337
Senior Full Stack Developer,vajro,"Chennai, India",https://stackoverflow.com/jobs/378547
SDET II,f5,"Hyderabad, India",https://stackoverflow.com/jobs/399332
SDE II,f5,"Hyderabad, India",https://stackoverflow.com/jobs/399331
Dot Net Senior COnsultant,Emergen Nexus Solutions Tehnologies & Pvt. Ltd.,"Bengaluru, India",https://stackoverflow.com/jobs/399328
Python/Workflow Developer,Affinity Express,"Pune, India",https://stackoverflow.com/jobs/349404
BIシステムの設計・開発業務,株式会社ビーネックステクノロジーズ,"Osaka, Japan",https://stackoverflow.com/jobs/315458
エンジニアリングマネージャー,株式会社MonotaRO,"Osaka, Japan",https://stackoverflow.com/jobs/315456
プロジェクトマネージャー・日本最大級のBtoBオンラインストア(東証一部上場),ヒューレックス株式会社,"Osaka, Japan",https://stackoverflow.com/jobs/315450
テクニカルアーティスト,株式会社ヘキサドライブ,"Osaka, Japan",https://stackoverflow.com/jobs/315440
【大阪】JAVA Pythonシステム開発(SE・PG),株式会社アクターリアリティー,"Osaka, Japan",https://stackoverflow.com/jobs/315431
サーバーエンジニア(サーバー管理),エックスサーバー株式会社,"Osaka, Japan",https://stackoverflow.com/jobs/315414
組込センサ→データ収集するIoTシステムの構築,株式会社パソナテック,"大阪市, Japan",https://stackoverflow.com/jobs/315412
クラウド基盤エンジニア(SRE),サイボウズ株式会社,"Osaka, Japan",https://stackoverflow.com/jobs/315407
QA エンジニア,株式会社MonotaRO,"Osaka, Japan",https://stackoverflow.com/jobs/315406
システムエンジニア,特許業務法人 HARAKENZO WORLD PATENT & TRADEMARK,"Osaka, Japan",https://stackoverflow.com/jobs/315404
サーバサイドエンジニア,株式会社インディゴゲームスタジオ,"Osaka, Japan",https://stackoverflow.com/jobs/315403
Senior Data Engineer,Menlo Technologies,"Hyderabad, India",https://stackoverflow.com/jobs/337143
(Java or Python or Golang) with Microservices - Software Engineer,f5,"Hyderabad, India",https://stackoverflow.com/jobs/337134
Manager,CloudnLoud,"Hyderabad, India",https://stackoverflow.com/jobs/337112
IT Security Engineer – PAM / PIM Engineer,technosoft corporation,"Hyderabad, India",https://stackoverflow.com/jobs/337104
SENIOR AUTOMATION ENGINEER (SCRIPTING),"OpsRamp, Inc.","Hyderabad, India",https://stackoverflow.com/jobs/337096
Senior Software/Systems Engineer,Ingrain Systems Inc.,"Hyderabad, India",https://stackoverflow.com/jobs/337083
Senior Full-Stack Software Engineer,Splash Financial,"Cleveland, OH",https://stackoverflow.com/jobs/305993
インフラエンジニア 正社員 WEB面接OK 六本木一丁目駅 大手美容系サービス展開企業におけるHadoop基盤開発・運用エンジニア,株式会社ビーネックスソリューションズ,"Minato City, Japan",https://stackoverflow.com/jobs/399324
"AWS, GCP, Azure経験者 AI/データ分析基盤構築",株式会社エイアイ・フィールド(AIフィールド),"Shinagawa City, Japan",https://stackoverflow.com/jobs/399323
プログラマ,オリエンタル情報システム株式会社,"Chiyoda City, Japan",https://stackoverflow.com/jobs/376730
フロントのコーディング作業,株式会社ビーネックスソリューションズ,"Minato City, Japan",https://stackoverflow.com/jobs/397449
正社員 WEB面接OK 虎ノ門 ヘルプデスク,株式会社ビーネックスソリューションズ,"Minato City, Japan",https://stackoverflow.com/jobs/399312
コールセンター業務,株式会社ビーネックスソリューションズ,"Minato City, Japan",https://stackoverflow.com/jobs/399311
【未経験OK】プログラマー(PG)・エンジニア(SE)【インターン】,株式会社トラスト・テクノロジー,"Kunitachi, Japan",https://stackoverflow.com/jobs/378124
ソフトウエア開発者,株式会社アストライアーソフトウエア,"Toshima City, Japan",https://stackoverflow.com/jobs/399310
ECサイト開発業務,株式会社ビーネックスソリューションズ,"Chiyoda City, Japan",https://stackoverflow.com/jobs/399308
健康管理システムの法人窓口業務,株式会社ビーネックスソリューションズ,"Koto City, Japan",https://stackoverflow.com/jobs/399307
フリーランス　会計システム導入支援　30代・40代活躍中,株式会社ビーブレイクシステムズ,"Koto City, Japan",https://stackoverflow.com/jobs/391220
フリーランス　教育系システム構築エンジニア　30代・40代活躍中,株式会社ビーブレイクシステムズ,"Taito City, Japan",https://stackoverflow.com/jobs/399300
フリーランス　エンハンス開発エンジニア　30代・40代活躍中,株式会社ビーブレイクシステムズ,"Chiyoda City, Japan",https://stackoverflow.com/jobs/391222
フリーランス　インフラ設計構築　30代・40代活躍中,株式会社ビーブレイクシステムズ,"Minato City, Japan",https://stackoverflow.com/jobs/399299
フリーランス　組み込み系システム開発　30代・40代活躍中,株式会社ビーブレイクシステムズ,"Shinagawa City, Japan",https://stackoverflow.com/jobs/399297
フリーランス　基幹システム構築エンジニア　30代・40代活躍中,株式会社ビーブレイクシステムズ,"Taito City, Japan",https://stackoverflow.com/jobs/399296
フリーランス　製造業向けシステム開発　30代・40代活躍中,株式会社ビーブレイクシステムズ,"Minato City, Japan",https://stackoverflow.com/jobs/391216
フリーランス　組み込み系開発業務　30代・40代活躍中,株式会社ビーブレイクシステムズ,"Minato City, Japan",https://stackoverflow.com/jobs/398015
【ロースキルからスキルアップ】開発(言語不問)/NW運用,株式会社ビットストロングソリューションズ,"Minato City, Japan",https://stackoverflow.com/jobs/391215
【大阪】Webプログラマー/インターネット/Webサービス・ASP,株式会社 ビヨンド,"Osaka, Japan",https://stackoverflow.com/jobs/397177
ソフトウェア評価検証技術者,株式会社プロサポート,"Nagoya, Japan",https://stackoverflow.com/jobs/399290
NW運用設計支援,株式会社プロサポート,"Nagoya, Japan",https://stackoverflow.com/jobs/399289
データ分析基盤構築エンジニア(マスメディアのビッグデータ),株式会社フォアキャスト・コミュニケーションズ,"Minato City, Japan",https://stackoverflow.com/jobs/399288
エンジニア,Spready株式会社,"Shibuya City, Japan",https://stackoverflow.com/jobs/376026
"社内システム開発エンジニア(Salesforce,AI)",type転職エージェント,"Minato City, Japan",https://stackoverflow.com/jobs/378748
《自社サービスAIエンジニア》人工知能による次世代OCR,株式会社インフォディオ,"Bunkyo City, Japan",https://stackoverflow.com/jobs/399287
SE・PG(WEB系)/web開発の上流工程のお仕事年配者大歓迎ご相談歓迎します,アジアプラントサービス株式会社,"四日市市, Japan",https://stackoverflow.com/jobs/399280
フロントエンドエンジニア(地方) / 不動産賃貸・仲介・管理,株式会社 TAPP,"Nagoya, Japan",https://stackoverflow.com/jobs/355203
システム設計 / システムインテグレータ・ソフトハウス,株式会社 新生ビジネスパートナーズ,"Kobe, Japan",https://stackoverflow.com/jobs/399269
システム開発 / システムインテグレータ・ソフトハウス,株式会社 新生ビジネスパートナーズ,"Kobe, Japan",https://stackoverflow.com/jobs/399268
プログラマ / システムインテグレータ・ソフトハウス,株式会社 新生ビジネスパートナーズ,"Kobe, Japan",https://stackoverflow.com/jobs/399267
システムエンジニア-SE・プログラマ-PG,株式会社ねこまた,"Chiyoda City, Japan",https://stackoverflow.com/jobs/399266
複合機・複写機基本設計 (大手印刷複合機開発製造メーカー) C#,株式会社スタッフサービス,"Tsukuba, Japan",https://stackoverflow.com/jobs/349430
AI・ビッグデータ要件定義 (産業機械のエンジニアリングメーカー) JavaScript,株式会社スタッフサービス,"Yokohama, Japan",https://stackoverflow.com/jobs/349257
AI・ビッグデータ要件定義 (大手プラントメーカー) JavaScript,株式会社スタッフサービス,"Yokohama, Japan",https://stackoverflow.com/jobs/349256
エンジニアリングマネージャー,株式会社アペルザ,"Yokohama, Japan",https://stackoverflow.com/jobs/349171
SE・PG/業務系システム開発・設計,株式会社リードウェイ,"Nagoya, Japan",https://stackoverflow.com/jobs/349130
WEBシステムエンジニア,京都エンタテインメントワークス株式会社,"Kyoto, Japan",https://stackoverflow.com/jobs/349074
"Software Engineer, Back End",Google,"Bengaluru, India",https://stackoverflow.com/jobs/382297
Software Engineer,Google,"Mountain View, CA",https://stackoverflow.com/jobs/348715
Software Engineer,Google,"New York, NY",https://stackoverflow.com/jobs/348716
Software Engineer,Google,"Waterloo, ON, Canada",https://stackoverflow.com/jobs/373687
Senior JavaScript/TypeScript Engineer,Interos,"Arlington, VA",https://stackoverflow.com/jobs/399259
Senior Data Software Engineer,Interos,"Arlington, VA",https://stackoverflow.com/jobs/399258
DevOps Engineer,Ezra,"Toronto, ON, Canada",https://stackoverflow.com/jobs/350443
Senior Engineering Manager,Ezra,"Toronto, ON, Canada",https://stackoverflow.com/jobs/350445
"Software Engineer, Test & Infrastructure",Vail Systems Inc.,"Deerfield, IL",https://stackoverflow.com/jobs/289451
Build and Integration Engineer (CI/CD),Peloton Interactive,"New York, NY",https://stackoverflow.com/jobs/296086
"Senior Software Engineer, Desktop Systems and Applications",PreVeil,"Boston, MA",https://stackoverflow.com/jobs/335973
Principal Cloud Engineer,"Unanet, Inc.","Sterling, VA",https://stackoverflow.com/jobs/399250
Senior Fullstack Engineer - AR Infrastructure,Mira Labs,"Los Angeles, CA",https://stackoverflow.com/jobs/372564
Senior Security Operations Engineer,Riot Games,"Dublin, Ireland",https://stackoverflow.com/jobs/372562
Senior Application Security Engineer,Riot Games,"Dublin, Ireland",https://stackoverflow.com/jobs/372560
Software Engineer - Infrastructure,Riot Games,"Dublin, Ireland",https://stackoverflow.com/jobs/372559
Senior Back End Engineer/Java Focus,Direct Supply,"Milwaukee, WI",https://stackoverflow.com/jobs/399246
Software Development Engineer II,Audible,"Newark, NJ",https://stackoverflow.com/jobs/239942
Software Test Engineer / Lab Technician,igolgi,"Barrington, IL",https://stackoverflow.com/jobs/348997
Principal Software Reliability & Performance Engineer,Federated Wireless,"Boston, MA",https://stackoverflow.com/jobs/399244
Senior DevNetOps Engineer (Cloud),SAP,"Belfast, UK",https://stackoverflow.com/jobs/393223
Lead BI Developer,CenturyLink,"Broomfield, CO",https://stackoverflow.com/jobs/372546
Head of Platform (m/f/d),Spryker Systems GmbH,"Berlin, Germany",https://stackoverflow.com/jobs/372355
Cloud Engineer,"Carnegie Robotics, LLC","Pittsburgh, PA",https://stackoverflow.com/jobs/399228
Technical Lead (HF)- Data Collect,ENGIE Digital,"Paris, France",https://stackoverflow.com/jobs/399225
"AI/ML - Machine Learning Engineer, Advanced Development",Apple,"Cupertino, CA",https://stackoverflow.com/jobs/393089
Solution Architect H/F,ENGIE Digital,"Paris, France",https://stackoverflow.com/jobs/399224
Développeur Full Stack (H/F) - LIVIN’,ENGIE Digital,"Paris, France",https://stackoverflow.com/jobs/399222
Full-Stack C# Entwickler,neo42 GmbH,"Burbach, Deutschland",https://stackoverflow.com/jobs/315211
Senior Data Engineer,Lynx Analytics,"Düsseldorf, Germany",https://stackoverflow.com/jobs/301448
Bioinformatics Engineer III,Memorial Sloan Kettering Cancer Center,"New York, NY",https://stackoverflow.com/jobs/312061
"Data Engineer, Digital and Computational Pathology",Memorial Sloan Kettering Cancer Center,"New York, NY",https://stackoverflow.com/jobs/378510
Backend Developer,Karlmax Berlin GmbH & Co. KG,"Berlin, Germany",https://stackoverflow.com/jobs/399216
Software Engineer,Barbaricum,"Springfield, VA",https://stackoverflow.com/jobs/296004
"Senior Security Researcher, Applications - 100% Remote Colombia South America",Sonatype,No office location,https://stackoverflow.com/jobs/370875
"Senior Security Researcher, Applications - 100% Remote Canada",Sonatype,No office location,https://stackoverflow.com/jobs/208728
Senior Data Engineer (m/w/d) Recommendation Engine,Evonik Industries AG,"Essen, Deutschland",https://stackoverflow.com/jobs/399213
Senior Consultant (m/w/d) im Bereich  SAP/HR,Evonik Industries AG,"Marl, Deutschland",https://stackoverflow.com/jobs/399212
Broadcast Systems Engineer,Apple,"London, UK",https://stackoverflow.com/jobs/399207
Cellular Systems Verification Engineer,Apple,"Bengaluru, India",https://stackoverflow.com/jobs/399202
Site Reliability Engineer - Apple Cloud Infrastructure (ACI),Apple,"Bengaluru, India",https://stackoverflow.com/jobs/399198
Machine Learning Engineer - 3D Body Pose Estimation,Apple,"Munich, Germany",https://stackoverflow.com/jobs/399197
"AI/ML - Applied Research Scientist - Sensing, Machine Intelligence",Apple,"Seattle, WA",https://stackoverflow.com/jobs/343590
Build Engineer,Apple,"Cupertino, CA",https://stackoverflow.com/jobs/386801
Site Reliability Engineer,Apple,"San Diego, CA",https://stackoverflow.com/jobs/399191
Audio Machine Learning DSP Research Engineer,Apple,"Cupertino, CA",https://stackoverflow.com/jobs/399190
"Technical Sales Specialist, Search Ads",Apple,"Cupertino, CA",https://stackoverflow.com/jobs/399189
"AI/ML- Data Engineer, Siri Performance and Reliability",Apple,"Cupertino, CA",https://stackoverflow.com/jobs/374816
"iOS/watchOS Carrier Settings Engineer, WTE",Apple,"Cupertino, CA",https://stackoverflow.com/jobs/344899
Blockchain Developer (m/w/d),SVA System Vertrieb Alexander GmbH,"Berlin, Deutschland",https://stackoverflow.com/jobs/382211
Senior Software EntwicklerIn (m/w/d),ThoughtWorks Inc.,"Stuttgart, Germany",https://stackoverflow.com/jobs/295609
Customer Support Engineer (Python) - Remote,Scrapinghub,No office location,https://stackoverflow.com/jobs/394263
DevOps Engineer Application Analytics,Swisscom AG,"Bern, Schweiz",https://stackoverflow.com/jobs/399172
(Senior) DevOps Engineer (f/m/x),Avira,"Tettnang, Deutschland",https://stackoverflow.com/jobs/399170
Machine Learning Engineer,Runtastic,"Linz, Austria",https://stackoverflow.com/jobs/399158
Senior Python Software Engineer - Join our growing team of 30+ developers,Tails.com,"Richmond, UK",https://stackoverflow.com/jobs/254448
PHP Developer & DevOps Engineer - Elvenar,innogames GmbH,"Hamburg, Deutschland",https://stackoverflow.com/jobs/399157
Laravel Developer,o2h Group,"Ahmedabad, India",https://stackoverflow.com/jobs/382175
サーバーサイドエンジニア《自社勤務/第2新卒可》,株式会社トレードワークス,"Chiyoda City, Japan",https://stackoverflow.com/jobs/348744
テックリード,株式会社アペルザ,"Yokohama, Japan",https://stackoverflow.com/jobs/348737
Cognitive Technologist or Practioner,Wipro Digital,"Bengaluru, India",https://stackoverflow.com/jobs/382154
製品開発・研究,LeapMind株式会社,"Shibuya City, Japan",https://stackoverflow.com/jobs/391572
Web Developer,Intelact Business Solutions,"Noida, India",https://stackoverflow.com/jobs/326213
クラウドエンジニア/ソフトウェア/パッケージベンダ,株式会社 イーリバースドットコム,"Koto City, Japan",https://stackoverflow.com/jobs/391571
プロジェクトリーダー/ソフトウェア/パッケージベンダ,株式会社 イーリバースドットコム,"Koto City, Japan",https://stackoverflow.com/jobs/391569
Webアプリケーションエンジニア/インターネット/Webサービス・ASP,株式会社 マーズフラッグ,"Shinjuku City, Japan",https://stackoverflow.com/jobs/391566
"Android, Php, Python developer",Middleton Logistic Solutions,"Kolkata, India",https://stackoverflow.com/jobs/399138
Full Stack Developer,Vencent Systems Private Limited,"Pune, India",https://stackoverflow.com/jobs/385121
Web Developer,B M Consulting,"Pune, India",https://stackoverflow.com/jobs/395562
Full Stack Developer,Compadre Technologies Pvt Ltd,"Pune, India",https://stackoverflow.com/jobs/399130
WEBアプリ/サーバサイド スーパーエンジニア【滋賀大津】 / インターネット/Webサービス・ASP,株式会社 ロックウェーブ,"Otsu, Japan",https://stackoverflow.com/jobs/319505
社内システム開発【新潟県県央】 / その他商社・流通・小売系,アークランドサカモト 株式会社,"Sanjo, Japan",https://stackoverflow.com/jobs/319260
グローバル空調IoTプラットフォーム開発,ダイキン工業株式会社 本社江坂ビル,"Suita, Japan",https://stackoverflow.com/jobs/391562
Openings in Microsoft Advanced Analytics,ICS Consultancy Services,"Hyderabad, India",https://stackoverflow.com/jobs/399103
Machine Learning Specialist,AlienTT,"Hyderabad, India",https://stackoverflow.com/jobs/354622
WEB開発で上流工程もやっていきたいエンジニア募集!,株式会社シスナビ,"Toshima City, Japan",https://stackoverflow.com/jobs/382122
エンジニアリングマネージャー,株式会社MonotaRO,"Minato City, Japan",https://stackoverflow.com/jobs/344706
エンジニア,株式会社イマジカデジタルスケープ,"Meguro City, Japan",https://stackoverflow.com/jobs/336722
《福岡》ソリューション・エンジニア,アクセンチュア株式会社,"Fukuoka, Japan",https://stackoverflow.com/jobs/318979
名古屋駅直結 トヨタも出資するビックデータ分析企業でデータアナリスト リーダークラス,株式会社ALBERT,"Nagoya, Japan",https://stackoverflow.com/jobs/382089
ソーシャルアプリエンジニア / インターネット/Webサービス・ASP,株式会社 スマイルマイスター,"Chiyoda City, Japan",https://stackoverflow.com/jobs/318136
シニアデータアナリスト,株式会社ユニクロ,"Shinagawa City, Japan",https://stackoverflow.com/jobs/361767
Sr. Full Stack Developer,Sureify,"Hyderabad, India",https://stackoverflow.com/jobs/382060
Software Engineer/WEB Developer,SUPARNA GLOBAL TECHNOLOGIES,"Hyderabad, India",https://stackoverflow.com/jobs/382058
WEBエンジニア・プログラマ,株式会社チームライク,"Ebina, Japan",https://stackoverflow.com/jobs/391550
フリーランス　システムマイグレーション対応　30代・40代活躍中,株式会社ビーブレイクシステムズ,"Kita City, Japan",https://stackoverflow.com/jobs/391541
ネットワーク構築技術者,株式会社プロサポート,"Nagoya, Japan",https://stackoverflow.com/jobs/388382
アプリケーション設計(オープン・WEB系) コンサルティングファーム・シンクタンク,日本アイ・ビー・エム グループ,"Hiroshima, Japan",https://stackoverflow.com/jobs/391523
アプリケーション設計(オープン・WEB系) コンサルティングファーム・シンクタンク,日本アイ・ビー・エム グループ,"Osaka, Japan",https://stackoverflow.com/jobs/391516
ITエンジニア,株式会社ネックス,"Toshima City, Japan",https://stackoverflow.com/jobs/399090
SE,株式会社JMDC,"Minato City, Japan",https://stackoverflow.com/jobs/398257
編集,株式会社イマジカデジタルスケープ,"Minato City, Japan",https://stackoverflow.com/jobs/399089
Web,マンパワーグループ株式会社,"Minato City, Japan",https://stackoverflow.com/jobs/399088
ゲームプログラマ,株式会社f4samurai,"Chiyoda City, Japan",https://stackoverflow.com/jobs/383210
アプリケーション設計(オープン・WEB系) コンサルティングファーム・シンクタンク,日本アイ・ビー・エム グループ,"Okayama, Japan",https://stackoverflow.com/jobs/391512
《大阪》ソフトフェアエンジニア《WEB面接可》,アクセンチュア株式会社,"Osaka, Japan",https://stackoverflow.com/jobs/399082
プロジェクトマネージャー,株式会社イマジカデジタルスケープ,"Osaka, Japan",https://stackoverflow.com/jobs/315423
サーバーサイドエンジニア / インターネット/Webサービス・ASP,Wantedly 株式会社,"Minato City, Japan",https://stackoverflow.com/jobs/309721
Python、Perl/通信キャリア向けオペレーション自動化PG作成,株式会社ブレーンネット,"Saitama, Japan",https://stackoverflow.com/jobs/398216
サーバーサイドエンジニア / Webマーケティング・ネット広告,株式会社 D2C R,"Chuo City, Japan",https://stackoverflow.com/jobs/309498
Cleared Software Engineer,CCRi,"Charlottesville, VA",https://stackoverflow.com/jobs/287276
サーバーサイドエンジニア / ゲーム・エンタメ,アングー 株式会社,"Meguro City, Japan",https://stackoverflow.com/jobs/309520
65万/Python/中古車販売webサービスの管理側サーバーサイド開発,株式会社ビズリンク,"Shibuya City, Japan",https://stackoverflow.com/jobs/399072
3DCGデザイナー,スマイルテクノロジーユナイテッド株式会社,"Yokohama, Japan",https://stackoverflow.com/jobs/309598
