title,company,location,link
Webアプリケーションエンジニア,type転職エージェント,"Minato City, Japan",https://stackoverflow.com/jobs/379412
サーバーサイドエンジニア / 新規サービス・NAVERまとめ,LINE株式会社,"Shinjuku City, Japan",https://stackoverflow.com/jobs/309994
サーバーサイドエンジニア,株式会社リブセンス,"Meguro City, Japan",https://stackoverflow.com/jobs/379405
Webエンジニア,株式会社メンバーズ メンバーズエッジカンパニー,"Chuo City, Japan",https://stackoverflow.com/jobs/318433
[社]未経験歓迎UnixCエンジニア/いきなり現場配属はありません,セブンシーズ株式会社,"Shinjuku City, Japan",https://stackoverflow.com/jobs/379401
ネットワークアプリケーションエンジニア,任天堂株式会社,"Taito City, Japan",https://stackoverflow.com/jobs/335785
コンテンツプラットフォームエンジニア,株式会社Gunosy,"Minato City, Japan",https://stackoverflow.com/jobs/375681
Senior Python Developer,MayStreet Inc.,"New York, NY",https://stackoverflow.com/jobs/396909
Technical Lead,"Jane Technologies, Inc.","Santa Cruz, CA",https://stackoverflow.com/jobs/377599
Software Developers and Operations Personnel for Healthcare Platform,CareEvolution,No office location,https://stackoverflow.com/jobs/379348
"Senior Software Engineer, Fullstack",valora digital.,"Zürich, Switzerland",https://stackoverflow.com/jobs/302271
"Internal Solutions Engineer, Global Marketing Solutions",Facebook,"Austin, TX",https://stackoverflow.com/jobs/379347
Network Engineer,Facebook,"Dublin, Ireland",https://stackoverflow.com/jobs/379346
Data Center Network Engineer,Facebook,"Menlo Park, CA",https://stackoverflow.com/jobs/379342
CAD & Methodology Engineer,Facebook,"Menlo Park, CA",https://stackoverflow.com/jobs/379336
Software Engineering Apprenticeship,Facebook,"London, UK",https://stackoverflow.com/jobs/379323
"Senior Software Engineer, Open RTB",Jelli,"San Mateo, CA",https://stackoverflow.com/jobs/389550
Distributed Systems Engineer,Aerial Applications,"Washington, DC",https://stackoverflow.com/jobs/370904
"Senior Software Engineer, Open RTB",Jelli,"Boise, ID",https://stackoverflow.com/jobs/389547
Senior Software Developer,"BPI, Inc","Vancouver, BC, Canada",https://stackoverflow.com/jobs/302265
Production Engineer,Facebook,"Seattle, WA",https://stackoverflow.com/jobs/353874
Senior DevOps Engineer (Security),SAP,"Shanghai, China",https://stackoverflow.com/jobs/389542
"Remote DevOps Engineer (Docker, AWS, Terraform)",FineTune Learning,No office location,https://stackoverflow.com/jobs/389541
Sr Software Quality Engineer,idwall,"São Paulo, Brazil",https://stackoverflow.com/jobs/370887
Software Engineer (Data Science),Unlearn.ai,"San Francisco, CA",https://stackoverflow.com/jobs/370884
"Software Engineer, Full Stack",Forward,"San Francisco, CA",https://stackoverflow.com/jobs/336573
"Software Engineer, Backend Infrastructure",Forward,"San Francisco, CA",https://stackoverflow.com/jobs/345270
"Manager, Edge Performance Optimization Engineering",Facebook,"Menlo Park, CA",https://stackoverflow.com/jobs/370830
Machine Learning Engineer,Builder,"Gurugram, India",https://stackoverflow.com/jobs/379294
Full-Stack Python Engineer,Gorgias,"Paris, France",https://stackoverflow.com/jobs/333474
Back-End Engineer,Gorgias,No office location,https://stackoverflow.com/jobs/371615
Backend Integration Test Engineer,"ThreatConnect, Inc.",No office location,https://stackoverflow.com/jobs/389524
Senior Software Developer,Klik,"Montreal, QC, Canada",https://stackoverflow.com/jobs/389522
Senior backend go developer,CEL,No office location,https://stackoverflow.com/jobs/370764
Lead developer Go+Angular,CEL,No office location,https://stackoverflow.com/jobs/370761
Lead Systems Engineer,Vistaprint,"Waltham, MA",https://stackoverflow.com/jobs/293708
Digital Network Exploitation Analyst - Entry/Mid-Level,National Security Agency,"Fort Meade, MD",https://stackoverflow.com/jobs/389497
Software Engineer - Entry to Experienced Level,National Security Agency,"Augusta, GA",https://stackoverflow.com/jobs/389493
Senior Deployment/DevOps Engineer,Enveil,"Fulton, MD",https://stackoverflow.com/jobs/319752
Senior Software Engineer @ Enveil,Enveil,"Fulton, MD",https://stackoverflow.com/jobs/166432
Senior Software Engineer Platform Development (m/f/d),On Running,"Berlin, Germany",https://stackoverflow.com/jobs/290364
SecOps,KI group GmbH,"Lisbon, Portugal",https://stackoverflow.com/jobs/379273
ASIC/FPGA Prototyping Product Engineer - SISW - MG 201759,Siemens AG,"Austin, TX",https://stackoverflow.com/jobs/371076
Senior Full Stack Developer with Backend Focus (startup),Anyfin AB,"Stockholm, Sweden",https://stackoverflow.com/jobs/273587
Medical Device Software Engineer,ARTIDIS AG,"Basel, Switzerland",https://stackoverflow.com/jobs/270177
Java-Developer (m/w/d),REWE Systems GmbH,"Köln, Germany",https://stackoverflow.com/jobs/378944
新サービス担当、クラウドエンジニア / ITコンサルティング,株式会社 エイアイ・フィールド,"Shinagawa City, Japan",https://stackoverflow.com/jobs/389419
Senior DevOps Engineer,Mobiquity Europe,"Amsterdam, Netherlands",https://stackoverflow.com/jobs/302120
データサイエンティスト(育成枠) / ITコンサルティング,株式会社 エイアイ・フィールド,"Shinagawa City, Japan",https://stackoverflow.com/jobs/334766
データエンジニア/経営/ビジネスコンサルティング・シンクタンク,株式会社 リンクアンドモチベーション,"Chuo City, Japan",https://stackoverflow.com/jobs/375699
Software Engineer (Core): Distributed Knowledge Graph and Reasoning Engine,Grakn Labs,"London, UK",https://stackoverflow.com/jobs/286597
"Softwareentwickler* / Entwicklungsingenieur* – Over-the-air-Updates mit Java, C#",IAV,"Gifhorn, Deutschland",https://stackoverflow.com/jobs/370717
IT-Praktikant (m/w/d) Big Data – Summer Internship Programme,ING-DiBa AG,"Nürnberg, Deutschland",https://stackoverflow.com/jobs/396899
"Software Engineer, Machine Learning",Facebook,"Bellevue, WA",https://stackoverflow.com/jobs/206001
PHP-Entwickler (m/w/d),Timme Hosting GmbH & Co. KG,"Lüneburg, Deutschland",https://stackoverflow.com/jobs/302058
【正社員】産業用機器システム開発/厚木,株式会社ワイズシステム研究所,"Atsugi, Japan",https://stackoverflow.com/jobs/378889
業務管理ソフトの開発業務,株式会社ビーネックステクノロジーズ,"Yamatokoriyama, Japan",https://stackoverflow.com/jobs/378883
2021 新卒採用 ソフトウエア 、 情報処理,株式会社ウィズテクノロジー,"Osaka, Japan",https://stackoverflow.com/jobs/376269
【SES】Salesforce Commerce Cloudエンジニア 募集要項,ルビー・グループ株式会社,"Shibuya City, Japan",https://stackoverflow.com/jobs/317783
Webエンジニア / インターネット/Webサービス・ASP,株式会社 アクシス,"Shibuya City, Japan",https://stackoverflow.com/jobs/319566
<ポテンシャル>エンジニア/Webマーケティング・ネット広告,株式会社 ARISE analytics,"Shibuya City, Japan",https://stackoverflow.com/jobs/389138
サーバーサイドエンジニア,auコマース&ライフ株式会社,"Shibuya City, Japan",https://stackoverflow.com/jobs/378719
PM/PL(経験者) / インターネット/Webサービス・ASP,Tech Fun 株式会社,"Taito City, Japan",https://stackoverflow.com/jobs/389135
データエンジニア(機械学習エンジニア)/ソフトウェア/パッケージベンダ,ブレインズテクノロジー 株式会社,"Minato City, Japan",https://stackoverflow.com/jobs/389133
System Engineer DevOps (m/f/d),Bonial International GmbH,"Berlin, Germany",https://stackoverflow.com/jobs/378682
Senior Microstrategy Developer,Jumbo Supermarkets,"Veghel, Netherlands",https://stackoverflow.com/jobs/389104
組み込み開発業務,株式会社ビーネックステクノロジーズ,"Kawasaki, Japan",https://stackoverflow.com/jobs/358473
AI・ビッグデータ要件定義 (大手鉄鋼メーカー) Python,株式会社スタッフサービス,"Yokohama, Japan",https://stackoverflow.com/jobs/358469
Senior C++ Developer,FileWave Gmbh,"Sarajevo, Bosnien und Herzegowina",https://stackoverflow.com/jobs/280967
"Software Developer Medical Interoperability, HL7, FHIR",RAYLYTIC GmbH,"Leipzig, Deutschland",https://stackoverflow.com/jobs/370700
Software Engineer / Data Platform,LINE株式会社,"Shinjuku City, Japan",https://stackoverflow.com/jobs/309642
Senior Django Developer,FileWave Gmbh,"Sarajevo, Bosnien und Herzegowina",https://stackoverflow.com/jobs/312936
Investigation Developer,Odoo,"Ramillies, Belgium",https://stackoverflow.com/jobs/167366
プロジェクトマネージャー / 業務システム開発・RPA,LINE株式会社,"Fukuoka, Japan",https://stackoverflow.com/jobs/358402
ソフトウェアエンジニア / ネットワーク / Private Cloud Platform,LINE株式会社,"Fukuoka, Japan",https://stackoverflow.com/jobs/358401
プロジェクトマネージャー/データ分析,LINE株式会社,"Fukuoka, Japan",https://stackoverflow.com/jobs/358400
プロジェクトマネージャー / 各LINEブランドサービス,LINE株式会社,"Fukuoka, Japan",https://stackoverflow.com/jobs/358399
ソフトウェアエンジニア / フロントエンド / Private Cloud Platform,LINE株式会社,"Shinjuku City, Japan",https://stackoverflow.com/jobs/335097
Junior Tableau (BI) Developer,AQAR,"Riyadh, Saudi Arabia",https://stackoverflow.com/jobs/378680
Developer (Python OR JavaScript),Odoo,"Ramillies, Belgium",https://stackoverflow.com/jobs/167359
Software Developer/ Software Programmer,Broadcast Engineering Consultants India Limited (BECIL),"New Delhi, India",https://stackoverflow.com/jobs/389087
検索エンジンエンジニア,type転職エージェント,"Shibuya City, Japan",https://stackoverflow.com/jobs/389084
Webデベロッパ/システムインテグレータ・ソフトハウス,アルカセット・コンサルティング 株式会社,"Shinjuku City, Japan",https://stackoverflow.com/jobs/356896
サーバーサイドエンジニア(税理士ドットコム),弁護士ドットコム株式会社,"Minato City, Japan",https://stackoverflow.com/jobs/318477
サーバサイドエンジニア / LINEポイント・LINE Sales Promotion等,LINE株式会社,"Fukushima, Japan",https://stackoverflow.com/jobs/378673
インフラエンジニア,株式会社リブセンス,"Meguro City, Japan",https://stackoverflow.com/jobs/378668
インフラエンジニア,リビン・テクノロジーズ株式会社,"Chuo City, Japan",https://stackoverflow.com/jobs/378660
サーバサイドエンジニア / LINEバイト・LINEキャリア・LINE採用コネクト・新規事業,LINE株式会社,"Shinjuku City, Japan",https://stackoverflow.com/jobs/318606
CTO室マネージャー,type転職エージェント,"Chuo City, Japan",https://stackoverflow.com/jobs/378645
サーバサイドエンジニア,ソウルドアウト株式会社,"Chiyoda City, Japan",https://stackoverflow.com/jobs/378642
開発×Python,株式会社キャリアデザインITパートナーズ,"Shinagawa City, Japan",https://stackoverflow.com/jobs/378621
【大阪】システムエンジニア募集,株式会社　ジェイテック,"Osaka, Japan",https://stackoverflow.com/jobs/333050
開発エンジニア,株式会社トップゲート,"Chiyoda City, Japan",https://stackoverflow.com/jobs/333006
開発エンジニア PL,株式会社トップゲート,"Chiyoda City, Japan",https://stackoverflow.com/jobs/333005
【愛知】プログラマー募集,株式会社　ジェイテック,"Nagoya, Japan",https://stackoverflow.com/jobs/333004
【愛知】システムエンジニア募集,株式会社　ジェイテック,"Nagoya, Japan",https://stackoverflow.com/jobs/333003
Whitebox Testing,Path Partner Technology,"Bengaluru, India",https://stackoverflow.com/jobs/358369
Senior Embedded Java Developer,TVS,"Bengaluru, India",https://stackoverflow.com/jobs/358345
Embedded Software Engineer,Path Partner Technology,"Bengaluru, India",https://stackoverflow.com/jobs/358333
Embedded Software Engineer,Ignitarium Technology Solutions,"Bengaluru, India",https://stackoverflow.com/jobs/358327
Sr. Embedded Sensors Engineer,Skylo Technologies,"Bengaluru, India",https://stackoverflow.com/jobs/358321
SMTS– Embedded Software – ML R&D,CareerXperts,"Bengaluru, India",https://stackoverflow.com/jobs/358320
Embedded Testing Engineer,TVS,"Bengaluru, India",https://stackoverflow.com/jobs/358318
Test Automation Engineer - Embedded - Bangalore,Roljobs Technology Services Pvt Ltd,"Bengaluru, India",https://stackoverflow.com/jobs/358313
Embedded Firmware engineer,Skylo Technologies,"Bengaluru, India",https://stackoverflow.com/jobs/358311
React js developer,Axcend Automation And Software Solutions Private Limited,"Chennai, India",https://stackoverflow.com/jobs/396863
Full Stack Developer,Blackstraw,"Chennai, India",https://stackoverflow.com/jobs/382890
Immediate Job Openings for Junior Software Developer 2020 Freshers,Softlogic Systems Pvt Ltd,"Chennai, India",https://stackoverflow.com/jobs/396853
PHP Developer,PayGyft,"Chennai, India",https://stackoverflow.com/jobs/396844
Hiring for Senior Full Stack Developer - Java,Turning Point HR Solutions,"Hyderabad, India",https://stackoverflow.com/jobs/396838
Sr. Java Full Stack Developer,Ajmera infotech,"Ahmedabad, India",https://stackoverflow.com/jobs/396836
Data Analytics Manager,Ro,"New York, NY",https://stackoverflow.com/jobs/332991
"Senior Software Engineer, Patient Care",Ro,"New York, NY",https://stackoverflow.com/jobs/332990
エンジニアオープンポジション(ジョブカン),株式会社Donuts,"Shibuya City, Japan",https://stackoverflow.com/jobs/389003
AI / Data Science Trainer (Antwerp),BeCode VZW,"Antwerpen, Belgium",https://stackoverflow.com/jobs/331290
Principal DevOps Engineer,Digital Guardian,"Hyderabad, India",https://stackoverflow.com/jobs/388986
6月開始 複数名募集 テレビ局で働く エンタメ好きな方歓迎 /開発エンジニア,株式会社キャリアデザインITパートナーズ,"Minato City, Japan",https://stackoverflow.com/jobs/388976
Immediate openings for DevOps,ICS Consultancy Services,"Hyderabad, India",https://stackoverflow.com/jobs/332906
システム開発エンジニア|月給24万円~|想定年収300~400万円|本町|62771|採用担当:小野,Inter・スクエア,"Osaka, Japan",https://stackoverflow.com/jobs/388947
SE(システムエンジニア),Enperor株式会社,"Taito City, Japan",https://stackoverflow.com/jobs/396826
SE,株式会社Legoliss,"Shibuya City, Japan",https://stackoverflow.com/jobs/396824
次期アデス構築プロジェクト,アクティブ・アイティ株式会社,"Bunkyo City, Japan",https://stackoverflow.com/jobs/396815
"Software Engineer, Fullstack",valora digital.,"Zürich, Switzerland",https://stackoverflow.com/jobs/388909
デジタルマーケティング・データ分析《東京・日本橋》,TDK株式会社,"Chuo City, Japan",https://stackoverflow.com/jobs/396814
《福岡》システムコンサルタント,アクセンチュア株式会社,"Fukuoka, Japan",https://stackoverflow.com/jobs/396803
Backend Engineer,Ame Digital,"Rio de Janeiro, Brazil",https://stackoverflow.com/jobs/301938
Security Analyst,Ultimate Software,Singapore,https://stackoverflow.com/jobs/388927
Web Services Director,"Innate, Inc.","Washington, DC",https://stackoverflow.com/jobs/260966
Experienced Back-end Developer for Large Autonomous Unmanned Aerial Systems,PEMDAS Technologies and Innovations,No office location,https://stackoverflow.com/jobs/388918
Software Integration Engineer,AIR Worldwide,"Boston, MA",https://stackoverflow.com/jobs/378526
Full-Stack Developer,TrinityRock Advisors,"Boston, MA",https://stackoverflow.com/jobs/345792
Production Engineer,Palantir,"New York, NY",https://stackoverflow.com/jobs/301922
Site Reliability Engineer,Palantir,"London, UK",https://stackoverflow.com/jobs/301899
Site Reliability Engineer,Palantir,"New York, NY",https://stackoverflow.com/jobs/301885
Software Engineer,Palantir,"London, UK",https://stackoverflow.com/jobs/301879
Software Engineer,Palantir,"Washington, DC",https://stackoverflow.com/jobs/301878
Engineering Manager,Force Therapeutics,"New York, NY",https://stackoverflow.com/jobs/260145
Site Reliability Engineer (W/M),EPFL - Blue Brain Project,"Genève, Switzerland",https://stackoverflow.com/jobs/332742
Forward Deployed Software Engineer,Palantir,"Munich, Germany",https://stackoverflow.com/jobs/301842
Forward Deployed Software Engineer,Palantir,"London, UK",https://stackoverflow.com/jobs/301835
Forward Deployed Software Engineer,Palantir,"New York, NY",https://stackoverflow.com/jobs/301834
Cleared Forward Deployed Software Engineer,Palantir,"Washington, DC",https://stackoverflow.com/jobs/301830
Sviluppatore Web Full Stack,Develer,"Florence, Italy",https://stackoverflow.com/jobs/301826
Embedded Linux and firmware engineer,Develer,"Florence, Italy",https://stackoverflow.com/jobs/301823
Sviluppatore software desktop e embedded,Develer,"Florence, Italy",https://stackoverflow.com/jobs/301776
Senior QA Automation Engineer,SG Digital,"Marousi, Greece",https://stackoverflow.com/jobs/279511
Senior Data Engineer,Babylist,"Oakland, CA",https://stackoverflow.com/jobs/366705
"Software Engineer (Ada, Python, Spark, Z)",Altran UK,"Bath, UK",https://stackoverflow.com/jobs/377147
Senior Software Engineer,Babylist,"Oakland, CA",https://stackoverflow.com/jobs/303084
Fullstack-Entwickler (w/m/d) am Standort Berlin,Hochfrequenz Unternehmensberatung GmbH,"Berlin, Germany",https://stackoverflow.com/jobs/358244
Keyboard Data Engineer,Apple,"Cupertino, CA",https://stackoverflow.com/jobs/396795
Developer Python (m/w/d),cluetec GmbH,"Karlsruhe, Deutschland",https://stackoverflow.com/jobs/358217
Senior Cloud DevOps Engineer - IaC,Semiotic Labs BV,"Leiden, Netherlands",https://stackoverflow.com/jobs/381720
Backend Engineer,Ascendify,No office location,https://stackoverflow.com/jobs/396789
Technical Lead,eBay,"Netanya, Israel",https://stackoverflow.com/jobs/388822
Senior Python Engineer (d/f/m),Stylight,"München, Deutschland",https://stackoverflow.com/jobs/279406
"Data Engineering Manager, Analytics (Messenger)",Facebook,"Menlo Park, CA",https://stackoverflow.com/jobs/370916
Linux System Engineer - REMOTE WORKING,Eidosmedia,No office location,https://stackoverflow.com/jobs/388815
Lead Infrastructure Engineer (Cloud),Northrop Grumman UK Limited,"Cheltenham, UK",https://stackoverflow.com/jobs/378469
Entwickler (w/m/d) im Bereich Glasfaser,AVM GmbH,"Berlin, Deutschland",https://stackoverflow.com/jobs/358210
Senior Software Engineer C++ for Quantum Computing,Zurich Instruments AG,"Zürich, Switzerland",https://stackoverflow.com/jobs/388813
Principal Software Engineer (Java),Northrop Grumman UK Limited,"London, UK",https://stackoverflow.com/jobs/378468
Lead Test Engineer (Software),Northrop Grumman UK Limited,"Cheltenham, UK",https://stackoverflow.com/jobs/378452
Lead Software Engineer (Java),Northrop Grumman UK Limited,"Cheltenham, UK",https://stackoverflow.com/jobs/378369
Senior Software Engineer (Java),Northrop Grumman UK Limited,"Manchester, UK",https://stackoverflow.com/jobs/378360
《大阪》Webエンジニア　/自社プロダクト,シルバーエッグ・テクノロジー株式会社,"Suita, Japan",https://stackoverflow.com/jobs/345749
Web系開発,Sky株式会社,"Osaka, Japan",https://stackoverflow.com/jobs/345743
リモート可|内製PHPエンジニア,株式会社リアズ,"Osaka, Japan",https://stackoverflow.com/jobs/345741
システムエンジニア《上流に携われる/設立50年の安定企業》,株式会社デジタルフォルン,"Chiyoda City, Japan",https://stackoverflow.com/jobs/345706
Mid Level Software Engineer (Full Stack),SG Digital,"London, UK",https://stackoverflow.com/jobs/279308
派遣/駅近北府中駅から2分 システム開発 Python C#,株式会社スタッフサービス　エンジニアガイド,"Fuchu, Japan",https://stackoverflow.com/jobs/345694
アプリケーションエンジニア,type転職エージェント,"Minato City, Japan",https://stackoverflow.com/jobs/345684
【リードエンジニア・チームリーダー】サーバーサイドエンジニア,株式会社アイリッジ,"Minato City, Japan",https://stackoverflow.com/jobs/345672
サーバーサイドエンジニア(ゲーム開発),株式会社gumi,"Shinjuku City, Japan",https://stackoverflow.com/jobs/345671
IT事業部スターティングメンバー(開発系職種),ワークタンク,"Meguro City, Japan",https://stackoverflow.com/jobs/345669
We are hiring Senior Data Engineer - Hyderabad,Klaxon India,"Hyderabad, India",https://stackoverflow.com/jobs/370585
Automation Test Engineers,Biarca,"Hyderabad, India",https://stackoverflow.com/jobs/370573
Data Scientist,ADCI HYD 13 SEZ,"Hyderabad, India",https://stackoverflow.com/jobs/370538
Consultant (AWS),Syntax Systems Ltd.,"Hyderabad, India",https://stackoverflow.com/jobs/370498
"Backend Engineer (C++, Golang, Nodejs)",SHIELD,Singapore,https://stackoverflow.com/jobs/262451
《大阪》CAE技術者(電磁界系パッケージ開発),株式会社JSOL,"Osaka, Japan",https://stackoverflow.com/jobs/315449
プログラマー / Webデザイナー,EBA株式会社,"Shinjuku City, Japan",https://stackoverflow.com/jobs/378354
中途採用データ基盤エンジニア,ピクシブ株式会社,"Shibuya City, Japan",https://stackoverflow.com/jobs/317342
システムエンジニア,インターリンク株式会社,"Chiyoda City, Japan",https://stackoverflow.com/jobs/378340
QAエンジニア(広告事業),Supershipグループ,"Minato City, Japan",https://stackoverflow.com/jobs/378339
データサイエンティスト,株式会社イマジカデジタルスケープ,"Minato City, Japan",https://stackoverflow.com/jobs/340198
暗号化通貨の取引所　制作/運用,株式会社センティリオンシステム,"Shinagawa City, Japan",https://stackoverflow.com/jobs/378336
プログラマ,株式会社シスナビ,"Toshima City, Japan",https://stackoverflow.com/jobs/378306
Pythonエンジニア,株式会社エム・フィールド,"Shinagawa City, Japan",https://stackoverflow.com/jobs/358157
ウェブアプリケーションエンジニア,株式会社アペルザ,"Yokohama, Japan",https://stackoverflow.com/jobs/358148
フロントエンドエンジニア,株式会社LOB,"Minato City, Japan",https://stackoverflow.com/jobs/378280
SRE (Site Reliability Engineer),株式会社LOB,"Minato City, Japan",https://stackoverflow.com/jobs/378279
【SE / PG】自社開発クラウドプライム案件/開発経験がある方歓迎!,株式会社ゲート,"Shinjuku City, Japan",https://stackoverflow.com/jobs/312102
SRE (Site Reliability Engineer) ※インフラエンジニア,type転職エージェント,"Minato City, Japan",https://stackoverflow.com/jobs/312093
画像処理センサーの組込み開発,株式会社ビーネックステクノロジーズ,"Kyoto, Japan",https://stackoverflow.com/jobs/312081
開発エンジニア,株式会社Jストリーム,"福岡市, Japan",https://stackoverflow.com/jobs/312072
開発環境・ツールエンジニア(コンシューマー・PC),株式会社スクウェア・エニックス,"Shinjuku City, Japan",https://stackoverflow.com/jobs/312069
Senior Software Engineer/Technical Lead,Napier Healthcare Solutions Pte. Ltd.,"Hyderabad, India",https://stackoverflow.com/jobs/396773
Software Development Manager-- NEW INITIATIVE,ADCI HYD 13 SEZ,"Hyderabad, India",https://stackoverflow.com/jobs/396764
Sr. Software System Designer,"Advanced Micro Devices, Inc.","Hyderabad, India",https://stackoverflow.com/jobs/396762
Senior Software Engineer - Data Science,The Straits Network,"Hyderabad, India",https://stackoverflow.com/jobs/396761
"Web API,.NET,C# + Angular 2 plus",technosoft corporation,"Hyderabad, India",https://stackoverflow.com/jobs/396759
Sr Test Engineer,Staffio HR,"Hyderabad, India",https://stackoverflow.com/jobs/396755
Programmer Analyst,ADCI HYD 13 SEZ,"Hyderabad, India",https://stackoverflow.com/jobs/396752
Software Development Enginee-II(L5),Amazon Dev Center India - Hyd,"Hyderabad, India",https://stackoverflow.com/jobs/396750
Network Engineer,WAVELABS TECHNOLOGIES,"Hyderabad, India",https://stackoverflow.com/jobs/396747
Senior software engineer,Husys,"Hyderabad, India",https://stackoverflow.com/jobs/352835
Software Development Engineer,ADCI HYD 20 SEZ,"Hyderabad, India",https://stackoverflow.com/jobs/396744
Automation Engineer,WAVELABS TECHNOLOGIES,"Hyderabad, India",https://stackoverflow.com/jobs/396743
Business Analyst I,Amazon Dev Center India - Hyd,"Hyderabad, India",https://stackoverflow.com/jobs/396740
BDT Data Engineering Manager,Amazon Dev Center India - Hyd,"Hyderabad, India",https://stackoverflow.com/jobs/396737
Data Engineer,ADCI HYD 13 SEZ,"Hyderabad, India",https://stackoverflow.com/jobs/396736
AVP / VP / Director Engineering,Grid Logic Software Private Limited,"Hyderabad, India",https://stackoverflow.com/jobs/396732
"Lead, Big Data Engineering, Smart MFG & AI",Micron,"Hyderabad, India",https://stackoverflow.com/jobs/396731
AI Engineer,Huddl,"Hyderabad, India",https://stackoverflow.com/jobs/396729
Senior Technology Specialist,WELLS FARGO BANK,"Hyderabad, India",https://stackoverflow.com/jobs/396728
Lead Data Scientist/Manager Data Scientist,CoreCompete,"Hyderabad, India",https://stackoverflow.com/jobs/396726
Quality Engineer 2,"Advanced Micro Devices, Inc.","Hyderabad, India",https://stackoverflow.com/jobs/396725
Analyst I,Bank of America,"Hyderabad, India",https://stackoverflow.com/jobs/396722
python trainer,Schema Technologies,"Hyderabad, India",https://stackoverflow.com/jobs/396720
Application Architect,WELLS FARGO BANK,"Hyderabad, India",https://stackoverflow.com/jobs/396719
