title,company,location,link
(Senior) Manager Digital Controlling & Business Analytics / Data Science (f/m/d),Fresenius SE & Co. KGaA,"Bad Homburg vor der Höhe, Deutschland",https://stackoverflow.com/jobs/387145
"Java,.net,Python,Android,Web Designing,Software Testing",V P Placement,"Pune, India",https://stackoverflow.com/jobs/328140
Sr. Software Developer (Fullstack) | B2B Pharma-tech Platform,Unnati,"Bengaluru, India",https://stackoverflow.com/jobs/395139
Full Stack Engineer/Developer/Tech Lead/Team Lead,Armentum,"Bengaluru, India",https://stackoverflow.com/jobs/395133
Cloud System Developers,Aptusai Engineering Pvt Ltd,"Bengaluru, India",https://stackoverflow.com/jobs/395128
Android Developer with Devops Expertise,Zen3 Infosolutions private limited,"Bengaluru, India",https://stackoverflow.com/jobs/395124
Trainee Developer,Hutech Solutions Pvt. Ltd,"Bengaluru, India",https://stackoverflow.com/jobs/395114
PHP Developer - CodeIgniter,Prostartme Technology Pvt Ltd,"Surat, India",https://stackoverflow.com/jobs/395100
"php Developer(Laravel,CodeIgniter,Python,Node JS,Cake php)",Doyenhub Software solution,"Surat, India",https://stackoverflow.com/jobs/395095
ANDROID AUDIO MOBILE APP DEVELOPER,Kalpamation software solutions pvt. ltd.,"Chennai, India",https://stackoverflow.com/jobs/395045
Senior Data Scientist,Evoke Technologies,"Hyderabad, India",https://stackoverflow.com/jobs/354708
Opportunity in Microsoft Advanced Analytics,ICS Consultancy Services,"Hyderabad, India",https://stackoverflow.com/jobs/354707
Backend Lead Engineer,Huddl,"Hyderabad, India",https://stackoverflow.com/jobs/354704
Search Relevance Engineer,freshworks,"Hyderabad, India",https://stackoverflow.com/jobs/354702
Application Support,technosoft corporation,"Hyderabad, India",https://stackoverflow.com/jobs/354699
Backend Engineer,Huddl,"Hyderabad, India",https://stackoverflow.com/jobs/354691
Python Scripting Jobs in Hyderabad,ICS Consultancy Services,"Hyderabad, India",https://stackoverflow.com/jobs/354690
Data Scientist & Business Development,Grid Logic Software Private Limited,"Hyderabad, India",https://stackoverflow.com/jobs/354684
Data Engineer - Business Data Technologies,Amazon Dev Center India - Hyd,"Hyderabad, India",https://stackoverflow.com/jobs/354669
Data Engineer,SpringML,"Hyderabad, India",https://stackoverflow.com/jobs/354650
SDE,Amazon Dev Center India - Hyd,"Hyderabad, India",https://stackoverflow.com/jobs/354631
Senior Machine Learning Engineer,Creditvidya,"Hyderabad, India",https://stackoverflow.com/jobs/354628
Principal Machine Learning Engineer,Leben Care Technologies,"Hyderabad, India",https://stackoverflow.com/jobs/354623
Machine Learning Algorithm Developer,Machinellium Mavericks Projects and Consultants,"Hyderabad, India",https://stackoverflow.com/jobs/354621
Machine learning Engineer (Hyderabad),Zessta,"Hyderabad, India",https://stackoverflow.com/jobs/354619
Machine Learning Scientist,Phenom People,"Hyderabad, India",https://stackoverflow.com/jobs/354618
Machine Learning Engineer,Grid Logic Software Private Limited,"Hyderabad, India",https://stackoverflow.com/jobs/354617
Devops Engineer,HighPoints Technologies India Private Limited,"Hyderabad, India",https://stackoverflow.com/jobs/395034
Senior Software QA Automation Engineer – SDK,PubMatic,"Pune, India",https://stackoverflow.com/jobs/395031
C#.net Developer,Pactera Technologies India Private Limited,"Bengaluru, India",https://stackoverflow.com/jobs/395002
プロダクトエンジニア,type転職エージェント,"Shibuya City, Japan",https://stackoverflow.com/jobs/376464
即日/交通費/Java・SQL/データ分析基盤の開発保守,株式会社エーティーエス,"Oita, Japan",https://stackoverflow.com/jobs/376462
2021 新卒採用 インターネット関連 、 芸能・映画・音楽,株式会社レコチョク,"Shibuya City, Japan",https://stackoverflow.com/jobs/376448
派遣/大手鉄鋼メーカーでの 大手 クラウドサービスの運用@弁天橋 JavaScript,株式会社スタッフサービス　エンジニアガイド,"Yokohama, Japan",https://stackoverflow.com/jobs/376415
インフラエンジニア(設計・構築),アイレット株式会社,"Osaka, Japan",https://stackoverflow.com/jobs/376389
SE(システムエンジニア),株式会社シャインソフト,"Minato City, Japan",https://stackoverflow.com/jobs/387118
システムエンジニア(テックリード候補),株式会社クロス・マーケティンググループ,"Shinjuku City, Japan",https://stackoverflow.com/jobs/319652
プロダクトオーナー APIマネージメントシステムの開発,KDDI株式会社,"Minato City, Japan",https://stackoverflow.com/jobs/387114
サーバーサイドエンジニア(ゲーム),株式会社パソナテック,"Meguro City, Japan",https://stackoverflow.com/jobs/394985
【副業OK】Webエンジニア(SE),トレスイノベーション株式会社,"Meguro City, Japan",https://stackoverflow.com/jobs/394981
【フルリモート/Go】自社プロダクト「ATOM」Webエンジニア,SO Technologies 株式会社,"Chiyoda City, Japan",https://stackoverflow.com/jobs/394980
【Go/Vue/フルリモートOK!】自社プロダクト「ライクル」Webエンジニア,SO Technologies 株式会社,"Chiyoda City, Japan",https://stackoverflow.com/jobs/394979
【フルリモート/React】自社サービス「Z.I.P.!」Webエンジニア,SO Technologies 株式会社,"Chiyoda City, Japan",https://stackoverflow.com/jobs/394978
SE(システムエンジニア),株式会社Fキャリアパートナーズ,"Chuo City, Japan",https://stackoverflow.com/jobs/394974
Full Stack Developer - Python & Django,LiveHealth,"Pune, India",https://stackoverflow.com/jobs/387071
システムエンジニア,レールコンサルティング株式会社,"Chuo City, Japan",https://stackoverflow.com/jobs/376372
システムエンジニア,株式会社Her's,"Kobe, Japan",https://stackoverflow.com/jobs/376342
AWSエンジニア,株式会社クロス・マーケティンググループ,"Shinjuku City, Japan",https://stackoverflow.com/jobs/376331
シニアサーバーサイドエンジニア / LINE NEWS,LINE株式会社,"Shinjuku City, Japan",https://stackoverflow.com/jobs/376320
システム基盤エンジニア,type転職エージェント,"Minato City, Japan",https://stackoverflow.com/jobs/310047
Full Stack Developer,Religate Technologies,"Hyderabad, India",https://stackoverflow.com/jobs/328763
ソフトウェアエンジニア,株式会社フォックス・リレーション,"Hiroshima, Japan",https://stackoverflow.com/jobs/394948
Principal Partner Solution Architect – World Famous US startup in Bengaluru!,CareerXperts,"Bengaluru, India",https://stackoverflow.com/jobs/328751
Sales Manager,Trezi,"Bengaluru, India",https://stackoverflow.com/jobs/328748
Senior Engineering Manager,Tuebora,"Bengaluru, India",https://stackoverflow.com/jobs/328744
Data Analytics and Assurance【SPA】,PwCあらた有限責任監査法人,"Chiyoda City, Japan",https://stackoverflow.com/jobs/387027
3名募集 即日スタート/交通費/ファイルサーバのテスト業務,株式会社エーティーエス,"Yokohama, Japan",https://stackoverflow.com/jobs/376192
Vieurekaプラットフォームのソフトウェア開発,パナソニック株式会社,"Moriguchi, Japan",https://stackoverflow.com/jobs/376149
ネットワークエンジニア・サーバー設計,株式会社ミッションアシスト,"Osaka, Japan",https://stackoverflow.com/jobs/376146
ソフトウェアエンジニア(リアルタイムデータパイプライン)・日本最大級BtoBオンラインストア(上場企業),ヒューレックス株式会社,"Osaka, Japan",https://stackoverflow.com/jobs/376145
ソフトウェアエンジニア(QA エンジニア)・日本最大級のBtoBオンラインストア(東証一部上場),ヒューレックス株式会社,"Osaka, Japan",https://stackoverflow.com/jobs/376142
国内外の製造拠点における生産革新活動を支援するITソリューション開発,パナソニック株式会社,"門真市, Japan",https://stackoverflow.com/jobs/376137
Webアプリエンジニア,アイレット株式会社,"Osaka, Japan",https://stackoverflow.com/jobs/376136
社内SE(社内ツール企画/開発)/フレックス勤務,株式会社Works Human Intelligence,"Minato City, Japan",https://stackoverflow.com/jobs/376123
ITエンジニア,株式会社　ケー・ウィズ・ピー,"Nagoya, Japan",https://stackoverflow.com/jobs/376120
Web系システムの AWS移行,株式会社ビーネックステクノロジーズ,"Nagoya, Japan",https://stackoverflow.com/jobs/376118
AWS案件/交通費全額/ビックデータ関連サービス開発,株式会社エーティーエス,"Nagoya, Japan",https://stackoverflow.com/jobs/376117
ITエンジニア,株式会社プロサポート,"Nagoya, Japan",https://stackoverflow.com/jobs/387024
機械設計オペレーター,株式会社プロサポート,"Nagoya, Japan",https://stackoverflow.com/jobs/387022
基幹システム導入技術者,株式会社プロサポート,"Nagoya, Japan",https://stackoverflow.com/jobs/387020
PCオペレーター,株式会社プロサポート,"Nagoya, Japan",https://stackoverflow.com/jobs/387019
データ サイエンティスト /　コンサルティングファーム,クライス&カンパニー,"Minato City, Japan",https://stackoverflow.com/jobs/387018
システムエンジニア,株式会社トリプルアイズ,"Chiyoda City, Japan",https://stackoverflow.com/jobs/376096
スマホアプリエンジニア,エムスリーキャリア株式会社,"Minato City, Japan",https://stackoverflow.com/jobs/376093
ゲーム業界/〔ゲーム開発〕サーバーサイドエンジニア(スタッフ),ランスタッド株式会社,"Shinjuku City, Japan",https://stackoverflow.com/jobs/376066
"時給3,100円 即日/交通費/Webポータルサイト開発",株式会社エーティーエス,"Chuo City, Japan",https://stackoverflow.com/jobs/376055
AWSを用いたインフラの設計・構築・運用を担当するエンジニア募集!,コインチェック株式会社,"Shibuya City, Japan",https://stackoverflow.com/jobs/366341
大手 交通費支給/バックエンドエンジニア募集(Python),株式会社エーティーエス,"Kobe, Japan",https://stackoverflow.com/jobs/376049
サービスを支える縁の下の力持ち!SREを募集!,コインチェック株式会社,"Shibuya City, Japan",https://stackoverflow.com/jobs/356476
Webエンジニア,株式会社光ソフトウェア,"Osaka, Japan",https://stackoverflow.com/jobs/376031
業務効率化に伴う作業の自動化業務,株式会社ビーネックステクノロジーズ,"Ikeda, Japan",https://stackoverflow.com/jobs/375963
新規開発,株式会社トライアルカンパニー,"Minato City, Japan",https://stackoverflow.com/jobs/375931
【管理】【横浜勤務】社内SE,株式会社ハイマックス,"横浜市, Japan",https://stackoverflow.com/jobs/375926
オペレーションマネージャー,クラスメソッド株式会社,"Chiyoda City, Japan",https://stackoverflow.com/jobs/375904
AI関連システムの開発(Python),株式会社キャリアデザインITパートナーズ,"Shibuya City, Japan",https://stackoverflow.com/jobs/375887
エンジニア,フォワードソフト株式会社,"Taito City, Japan",https://stackoverflow.com/jobs/375872
プログラマー,シービーエス株式会社,"Shinjuku City, Japan",https://stackoverflow.com/jobs/375869
プログラム開発における要件定義や設計,シービーエス株式会社,"Shinjuku City, Japan",https://stackoverflow.com/jobs/375864
データサイエンティスト,合同会社DILIGENCE,"Shibuya City, Japan",https://stackoverflow.com/jobs/375839
派遣/便利な西新宿 請求支払管理画面の開発 10時出社 PHP,株式会社スタッフサービス　エンジニアガイド,"Shinjuku City, Japan",https://stackoverflow.com/jobs/375830
研究員または特別研究員,理化学研究所,"Kiryu, Japan",https://stackoverflow.com/jobs/394945
webシステム開発のお仕事,株式会社パソナテック,"Kyoto, Japan",https://stackoverflow.com/jobs/394944
社内SE要件定義 (リース会社でのお仕事です ) Java,株式会社スタッフサービス,"Minato City, Japan",https://stackoverflow.com/jobs/375807
WEB系システムエンジニア・プログラマー,株式会社NIXE,"Chiyoda City, Japan",https://stackoverflow.com/jobs/394936
紹介予定派遣/人気紹介予定派遣のお仕事 社内SE@六本木一丁目 Java,株式会社スタッフサービス　エンジニアガイド,"Minato City, Japan",https://stackoverflow.com/jobs/375803
ソフトウェアエンジニア,株式会社フォックス・リレーション,"Matsue, Japan",https://stackoverflow.com/jobs/394933
ITエンジニア(Java/Swift/Kotlin/JavaScript/Python)スタートアップメンバー募集!!,App Hearts株式会社,"Shibuya City, Japan",https://stackoverflow.com/jobs/375753
インフラエンジニア,株式会社マイクロアド,"Shibuya City, Japan",https://stackoverflow.com/jobs/375702
即日~/6名募集/交通費全額/ビックデータ基盤システム開発,株式会社エーティーエス,"Minato City, Japan",https://stackoverflow.com/jobs/375700
データエンジニア,アスタミューゼ株式会社,"Chiyoda City, Japan",https://stackoverflow.com/jobs/375697
基盤デザイン・構築・ビッグデータ解析,株式会社アイソル,"Shinagawa City, Japan",https://stackoverflow.com/jobs/354071
データエンジニア(データ事業),type転職エージェント,"Minato City, Japan",https://stackoverflow.com/jobs/375696
システムエンジニア,デジタル・アドバタイジング・コンソーシアム株式会社,"Oita, Japan",https://stackoverflow.com/jobs/340601
SENIOR BACK-END DEVELOPER(シニア バックエンド デベロッパー),FunkyCorp Ltd.,"Minato City, Japan",https://stackoverflow.com/jobs/375678
SENIOR FULL-STACK DEVELOPER(シニア フルスタック デベロッパー),FunkyCorp Ltd.,"Minato City, Japan",https://stackoverflow.com/jobs/375652
インフラエンジニア(設計・構築),アイレット株式会社,"Nagoya, Japan",https://stackoverflow.com/jobs/375598
プログラマ,パーソル パナソニック HRパートナーズ株式会社 テクニカル事業本部,"Nagoya, Japan",https://stackoverflow.com/jobs/375596
認知症患者向けコミュニケーションロボット「コモモン」の開発メンバー,The Harmony Inc.(ザ・ハーモニー株式会社),"Fukuoka, Japan",https://stackoverflow.com/jobs/375571
札幌市中央区勤務、アプリ開発経験者募集、他社派遣無しの社内SE正社員,株式会社FDSホールディングス,"Sapporo, Japan",https://stackoverflow.com/jobs/375567
2021 新卒採用 ソフトウエア 、 インターネット関連、情報処理,クリプトン・フューチャー・メディア株式会社,"Sapporo, Japan",https://stackoverflow.com/jobs/375566
2021 新卒採用 企画系,クリプトン・フューチャー・メディア株式会社,"Sapporo, Japan",https://stackoverflow.com/jobs/375565
札幌中央区、フレックス制の社内SE!プログラマー募集!,株式会社FDSホールディングス,"Sapporo, Japan",https://stackoverflow.com/jobs/375564
任期制エンジニア,国立研究開発法人物質・材料研究機構,"Tsukuba, Japan",https://stackoverflow.com/jobs/375548
SE・プログラマ 2021卒,株式会社イーグリッド,"Maebashi, Japan",https://stackoverflow.com/jobs/375533
PM/PL候補 自社開発クラウドエンジニア(salesforce、AWS、Heroku等未経験者歓迎)/裁量労働制,株式会社フレクト,"Chiyoda City, Japan",https://stackoverflow.com/jobs/375529
Senior Software Engineer- GoLang,Frontdoor,"Pune, India",https://stackoverflow.com/jobs/367687
QA Automation Engineer - Python,Keywordio,"Pune, India",https://stackoverflow.com/jobs/367683
Lead Software Development Engineer in Test (SDET),Foghorn Systems,"Pune, India",https://stackoverflow.com/jobs/367675
Quality Assurance Engineer - CFD,simulationHub,"Pune, India",https://stackoverflow.com/jobs/367669
product engineer qa,Demand Farm,"Pune, India",https://stackoverflow.com/jobs/367668
QA Engineer,InfraCloud,"Pune, India",https://stackoverflow.com/jobs/367664
Software Engineer - Intern (2020),Keywordio,"Pune, India",https://stackoverflow.com/jobs/367643
新プロダクト開発マネージャー(課長職)新サービス立ち上げ/自社プロダクト,ソフトブレーン株式会社,"Chuo City, Japan",https://stackoverflow.com/jobs/354537
【アプリ開発経験者歓迎】ゲームエンジニアを募集します!残業月20時間以内!アニメに興味ある方歓迎!,株式会社ゲート,"Shinjuku City, Japan",https://stackoverflow.com/jobs/311469
フロントエンドエンジニア/re:shineチーム,株式会社メタップス,"Minato City, Japan",https://stackoverflow.com/jobs/354494
Research Engineer,"Edgestream Partners, L.P.","Princeton, NJ",https://stackoverflow.com/jobs/357879
その他、コンサルタント系,株式会社よきあす,"Chiyoda City, Japan",https://stackoverflow.com/jobs/351506
【学歴不問!働きやすさ重視】エンジニア経験浅い方もOK・自社内開発有り・取得支援対象資格100種以上!B019,株式会社KIDA,"Osaka, Japan",https://stackoverflow.com/jobs/367571
[배달의민족부문] 검색서비스 개발자 모집,Woowa Brothers,"Sincheon-dong, South Korea",https://stackoverflow.com/jobs/277548
Senior Backend Developer (Remote),Hypothesis.is,No office location,https://stackoverflow.com/jobs/375432
Senior Frontend Developer (Remote),Hypothesis.is,No office location,https://stackoverflow.com/jobs/375433
Statistician,Unlearn.ai,"San Francisco, CA",https://stackoverflow.com/jobs/386848
Senior Backend Engineer AI Lab (Ruby on Rails),Kaia Health Software GmbH,"München, Germany",https://stackoverflow.com/jobs/343596
Senior Backend Engineer,Density,No office location,https://stackoverflow.com/jobs/394915
Software Developer for Investment Firm,Dean Capital Investments Management,"Vienna, VA",https://stackoverflow.com/jobs/274185
Data Engineer,"DC Energy, LLC","Vienna, VA",https://stackoverflow.com/jobs/88064
Trading Operations Engineer,"Edgestream Partners, L.P.","Princeton, NJ",https://stackoverflow.com/jobs/359727
Data Scientist,Xpand IT,"Lisboa, Portugal",https://stackoverflow.com/jobs/386447
Software Engineer Embedded-Middleware and Fullstack-Development,320EAST GmbH,"Karlsruhe, Deutschland",https://stackoverflow.com/jobs/307749
Python Developer,Kaspersky,"Moscow, Russia",https://stackoverflow.com/jobs/394912
Middle/Senior DevOps Engineer (Kaspersky Fraud Prevention),Kaspersky,"Moscow, Russia",https://stackoverflow.com/jobs/394910
DevOps Engineer,Kaspersky,"Moscow, Russia",https://stackoverflow.com/jobs/394909
Senior SRE/Support Engineer,EverQuote Inc.,No office location,https://stackoverflow.com/jobs/394908
Praktikum in der Softwareentwicklung (Java),Senacor Technologies AG,"München, Deutschland",https://stackoverflow.com/jobs/354420
Full-Stack Python Engineer,Gorgias,No office location,https://stackoverflow.com/jobs/374584
Lead Cloud Operations Engineer,Lime,"Lund, Sweden",https://stackoverflow.com/jobs/375369
SAP Concur - Senior AWS Software Engineer,SAP,"Praha 7, Czechia",https://stackoverflow.com/jobs/394905
Intern - Visual Computing (Android)- Graphics Performance Optimisation,Samsung Electronics UK LTD,"Staines-upon-Thames, UK",https://stackoverflow.com/jobs/394904
"Senior Data Engineer (w/m/d) - Köln, Paderborn oder remote",DeepL GmbH,"Köln, Deutschland",https://stackoverflow.com/jobs/394900
"Software Developer – Research Tooling (w/m/d) - Köln, Paderborn oder remote",DeepL GmbH,"Köln, Deutschland",https://stackoverflow.com/jobs/394896
Senior Data Engineer (Python),Back Market,"Paris, France",https://stackoverflow.com/jobs/283890
(Senior) Research Developer (f/m/d) for SAP Industry 4.0 - SAP Munich,SAP,"Hallbergmoos, Germany",https://stackoverflow.com/jobs/386835
(Senior) Research Developer (f/m/d) for SAP Industry 4.0 - SAP Munich,SAP,"Hallbergmoos, Germany",https://stackoverflow.com/jobs/381736
Lead Software Development Consultant,Stride Consulting,"New York, NY",https://stackoverflow.com/jobs/297366
Lead Software Development Consultant,Stride Consulting,"New York, NY",https://stackoverflow.com/jobs/387404
Lead Software Development Consultant,Stride Consulting,"New York, NY",https://stackoverflow.com/jobs/387405
Site Reliability Engineer,Higher Logic,"Arlington, VA",https://stackoverflow.com/jobs/375357
Python Developer (Backend),Energyworx,"Houten, Netherlands",https://stackoverflow.com/jobs/165665
QA Engineer,Back Market,"Paris, France",https://stackoverflow.com/jobs/283888
Engineering Manager - Cloud Infrastructure,Back Market,"Paris, France",https://stackoverflow.com/jobs/198320
Mobile Developer (iOS / Android / Full-Stack),HaysviaHays plc,"Atlanta, GA",https://stackoverflow.com/jobs/394890
Data Developer,"Songspace, INC","Nashville, TN",https://stackoverflow.com/jobs/386824
"Senior Manager, Data Engineering",Integral Ad Science,"Chicago, IL",https://stackoverflow.com/jobs/394886
Senior Software Engineer C++,Zurich Instruments AG,"Zürich, Switzerland",https://stackoverflow.com/jobs/217698
"Lead Software Engineer (C#, SQL) for leading financial SaaS company",Basware,"Leppävaara, Finland",https://stackoverflow.com/jobs/354332
Senior Full Stack Software Engineer (React & Django),Sector Labs,"Cluj-Napoca, Romania",https://stackoverflow.com/jobs/241611
Principal Full Stack Software Engineer (React & Django),Sector Labs,"Cluj-Napoca, Romania",https://stackoverflow.com/jobs/249484
Full Stack Software Engineer (React & Django),Sector Labs,"Cluj-Napoca, Romania",https://stackoverflow.com/jobs/242127
PHP Senior Entwickler,goTom,"Zürich, Schweiz",https://stackoverflow.com/jobs/338758
Release Engineer,Facebook,"Menlo Park, CA",https://stackoverflow.com/jobs/283081
Technical Manager (Software Development),Clickatell Pty Ltd,"Toronto, ON, Canada",https://stackoverflow.com/jobs/386763
Software engineer – Lead Frontend Engineer (W/M),EPFL - Blue Brain Project,"Genève, Switzerland",https://stackoverflow.com/jobs/354283
Principal Software Development Engineer,Pixelogic Media,"Madinet Al Eelam, Egypt",https://stackoverflow.com/jobs/386758
Data Science Chapter Lead,ING,"Amsterdam, Netherlands",https://stackoverflow.com/jobs/394880
Senior React developer,Lab Technologies SA,"Chiasso, Switzerland",https://stackoverflow.com/jobs/350851
SAP Concur - AWS Software Engineer,SAP,"Praha 7, Czechia",https://stackoverflow.com/jobs/394879
Senior Data Engineer (m/f/d) for a Munich Start-Up,Cluno GmbH,"München, Deutschland",https://stackoverflow.com/jobs/360748
PHP DEVELOPER,Ambiot,"Hyderabad, India",https://stackoverflow.com/jobs/367519
プログラマー,株式会社ビジョン・コンサルティング,"Shinjuku City, Japan",https://stackoverflow.com/jobs/328534
AI Research Engineer/Working in Japan,Medmain Inc.,"Tokyo, Japan",https://stackoverflow.com/jobs/384589
Python and Django Developer,Vivenns,"Hyderabad, India",https://stackoverflow.com/jobs/343535
Python with Automation Testing,Saransh,"Hyderabad, India",https://stackoverflow.com/jobs/343513
Brownie Points,The Cirqus,"Hyderabad, India",https://stackoverflow.com/jobs/343512
Python Developer,InfoMagnus,"Hyderabad, India",https://stackoverflow.com/jobs/343508
Openings in SDN NFV Software,ICS Consultancy Services,"Hyderabad, India",https://stackoverflow.com/jobs/343492
Urgent Requirement Apache Spark,ICS Consultancy Services,"Hyderabad, India",https://stackoverflow.com/jobs/343488
Immediate jobs in Google Cloud Dataproc,ICS Consultancy Services,"Hyderabad, India",https://stackoverflow.com/jobs/343482
Python programmer,HJ Software,"Hyderabad, India",https://stackoverflow.com/jobs/343481
Software Consultant (Python & PostgreSQL),Energytech Global,"Hyderabad, India",https://stackoverflow.com/jobs/343477
Python Automation Tester,Innominds Software,"Hyderabad, India",https://stackoverflow.com/jobs/343453
Water Resources Engineer,Aapah Innovations,"Hyderabad, India",https://stackoverflow.com/jobs/343444
Full Stack Developer,Imurgence,"New Delhi, India",https://stackoverflow.com/jobs/343392
プログラマ,株式会社zerophy,"Shibuya City, Japan",https://stackoverflow.com/jobs/386725
開発エンジニア　業務系アプリケーションエンジニア　プログラマ,株式会社Her's,"Chiyoda City, Japan",https://stackoverflow.com/jobs/386721
PSN CICD開発エンジニア,株式会社ソニー・インタラクティブエンタテインメント,"Minato City, Japan",https://stackoverflow.com/jobs/317070
APIシステムアーキテクト / ソフトウェア/パッケージベンダ,サイオステクノロジー 株式会社,"Minato City, Japan",https://stackoverflow.com/jobs/320086
オープンポジション※ご経験や適性に応じてポジションを提案させていただきます / その他IT/Web・通信・インターネット系,株式会社 グッドパッチ,"Shibuya City, Japan",https://stackoverflow.com/jobs/354074
バックエンドエンジニア(DMP事業),type転職エージェント,"Minato City, Japan",https://stackoverflow.com/jobs/386708
ソフトウェアエンジニア,エムスリー株式会社,"Minato City, Japan",https://stackoverflow.com/jobs/309551
Webエンジニア,GROOVEX株式会社,"中央区, Japan",https://stackoverflow.com/jobs/386695
フロントエンジニア,株式会社TesTee,"Chuo City, Japan",https://stackoverflow.com/jobs/386670
PM / システムインテグレータ・ソフトハウス,株式会社 h2ワークス,"Chiyoda City, Japan",https://stackoverflow.com/jobs/319669
Webエンジニア,株式会社イマジカデジタルスケープ,"Minato City, Japan",https://stackoverflow.com/jobs/386332
